title,company,link,description,location,date_added,date_posted,job_type,salary,apply_text,status
Senior Product Owner GenAI,Zolon Tech Solutions Inc,https://www.dice.com/job-detail/83e9e453-3c32-4a79-a83e-ed6635011a43,"Title : Senior Product Owner GenAI Location : Reston, VA Duration : 12 Months (Contract to Hire) Work Mode: Hybrid Must attend PI planning onsite every 10 weeks Conversion Intent: Yes (Temp-to-Hire) Job Description: Remote DMV Area Only (Reston, VA or Washington, DC)Client is hiring a Senior Product Owner to lead a GenAI-focused chatbot product.This person will work closely with cross-functional teams (data scientists, ML engineers, developers, and compliance) to identify AI use cases and drive",Remote,07/24/2025,Today,Contract,Depends on Experience,Easy Apply,Applied
ML Engineer,Srinav Inc.,https://www.dice.com/job-detail/f6f7b5cd-da18-476d-b708-9dde41f81448,"Role: ML Engineer Duration: Long term Location: CA,WA,FL,NY - Onsite Orlando, Florida San Francisco, California Seattle, Washington New York, New York Skills: Machine learning, and deep learning techniques, exploratory data analysis (EDA), data science Key Responsibilities: Design and implement robust anomaly detection algorithms using statistical, machine learning, and deep learning techniques. Develop scalable data pipelines to process and analyze large volumes of streaming and batch data. C","Orlando, Florida",07/23/2025,Today,"Third Party, Contract",Depends on Experience,Easy Apply,Applied
Gen AI/ML resource with experience with either Agentforce (primarily) or Salesforce Einstein,ProCorp Systems Inc.,https://www.dice.com/job-detail/f4287c1f-6dff-4a36-b608-159134660162,"Required Certifications/Education: Master s degree in computer science, Artificial Intelligence, Machine Learning, or a related field. (Equivalent practical experience may be considered) Relevant Certifications on AI, ML, GenAI and Agentic AI disciplines (at minimum 2-3 certifications are recommended) such as Agentic AI certifications/badges offered by leading industry course providers and platforms (like Courseera, Udemy, Deeplearning.AI etc.) Required Skills & Experience: Required 2+ years of",Remote,07/23/2025,Today,"Contract, Third Party",Depends on Experience,Easy Apply,Applied
Senior Computer Vision Engineer,Aditi Consulting,https://www.dice.com/job-detail/a21772e1-5233-446b-9847-531440010fc8,"Payrate: $100.00 - $119.60/hr. Summary: The Cameras Architecture Team is looking for an Optical Modeling Engineer to develop and validate optical models for an end-to-end camera simulation pipeline that consists of image sensor, optics, and imaging algorithms. Your work will drive the study and validation of new camera technologies and architectures for products across different categories from Smart Glasses, AR to MR. If you are excited about learning first principles and applying your skill","Sunnyvale, California",07/23/2025,Today,Contract,$100 - $119.6 hr,Easy Apply,Applied
MLOps & Data Science Consultant,"VDart, Inc.",https://www.dice.com/job-detail/0730b8e0-fc65-4312-98c4-1aca12e3acec,"MLOps & Data Science Consultant 3 Months Contract Seattle, WA (Remote Onsite) Hands On: Python (Pandas, NumPy, Scikit-learn) Databricks (PySpark, Delta Lake) Snowflake (SQL, Snowpark) MLflow Knowledge of: CI/CD for ML Docker and Kubernetes Git and version control Feature engineering and model evaluation A/B testing and monitoring of ML models Experience: 2-3 years in productionizing machine learning pipelines Working knowledge of cloud platforms (AWS, Azure, or Google Cloud Platform)","Seattle, Washington",07/23/2025,Today,"Contract, Third Party",$$Negotiable,Easy Apply,Applied
Lead Product Owner (GenAI + LLM),Lumen Solutions Group Inc.,https://www.dice.com/job-detail/b32bdad2-18ad-4aa7-b74b-1f25100d4b56,"Role: Lead Product Owner (GenAI + LLM) Location: Reston, VA (Hybrid) About the Role: Company is seeking Lead Product Owner, including at least 2 years working with Generative AI / LLMs. The ideal candidate will have experience in backlog management, performance tracking, and developing AI-driven or chatbot-type products. Key Responsibilities: Drive product vision and execution for AI-focused applications (chatbots, LLM integration, GenAI) Lead backlog grooming, prioritization of EPICs and user s","Hybrid in Reston, Virginia",07/24/2025,Today,Contract,BASED ON EXPERIENCE,Easy Apply,Applied
"Test Engineer (GenAI, Automation)",Elite Technical,https://www.dice.com/job-detail/f60c102e-6c3e-4d32-8690-17f3fdf4fdf3,"Elite Technical is seeking a Test Engineer with specific testing expertise in GenAI, along with strong Automation abilities leveraging Python. The selected candidate will join our client-s Software Quality Assurance Team to assist with monitoring programs/projects in the organization to ensure the practices, polices, processes and regulations are adhered, review current policies, standards, plans, processes, and procedures and conduct assessments at the program/project level, report finding and",Remote,07/18/2025,Today,Contract,Depends on Experience,Easy Apply,Applied
"Azure Databricks Engineer / Advance Data Engineer || Cincinnati, OH (Day 1 onsite)",Amaze Systems Inc,https://www.dice.com/job-detail/db0ad53a-b03b-499d-bc97-f61047844177,"Hello I hope you are doing well. This is Ranjit Singh from Amaze Systems. We are urgently hiring for a Azure Databricks Engineer / Advance Data Engineer position. Kindly share your resume and connect with me to discuss the next steps. Role: Azure Databricks Engineer / Advance Data Engineer Location:- Cincinnati, OH (Day 1 onsite) Duration: Long Term Client is looking Sr. Candidate , having around 14+ Years exp. min Job Description: Need more on Databricks Data Engineer Azure, Google Cloud Pla","Cincinnati, Ohio",07/24/2025,Today,"Full-time, Third Party",,Easy Apply,Applied
Senior AI Engineer,Infinite Computer Solutions (ICS),https://www.dice.com/job-detail/848f140f-1638-46bf-86fd-8aa8d718a1f9,"Senior AI Engineer Automation & Delivery Optimization (Banking Platforms/Professional services) Location -Remote Full-time / W2 - with Infinite Computer Solutions Job Summary We are seeking an experienced Sr. AI Engineer to lead the design, development and deployment of intelligent automation solutions tailored to online banking platforms. This role combines deep AI/ML expertise with financial domain knowledge to streamline product delivery, enhance customization, and optimize client engagement","Berkeley Heights, New Jersey",07/24/2025,Today,Full-time,Depends on Experience,Easy Apply,Applied
"ML/AI Developer , Sunnyvale, CA",Synkriom,https://www.dice.com/job-detail/d1c785a9-01bb-4657-a49d-f8720acc8899,"ML/AI Developer Duration: 12month+ Onsite/Hybrid/Remote: hybrid (Sunnyvale, CA office) Only locals Machine Learning AI Developer - IT Infrastructure, InfoSec, and Operations We are seeking a talented and innovative Machine Learning AI Developer to join our IT Infrastructure, InfoSec, and Operations team. In this role, you will be at the forefront of leveraging artificial intelligence to enhance our organization s security, efficiency, and operational capabilities. Responsibilities: Design, devel","Hybrid in Sunnyvale, California",07/23/2025,Today,Contract,Depends on Experience,Easy Apply,Applied
Data Scientist with IQVIA (Must have),Engineering Square,https://www.dice.com/job-detail/2e1a18ef-71e3-4adf-901a-c145e7326671,"Job Title: Data Scientist Work Location: Onsite in Connecticut (NYC/Hudson Valley area) EX-IQVIA Experience is Must have. Day to day work: Working with IQVIA and End Customer to cultivate analytics and reporting requirements Working with IQVIA and End Customer to develop data and analytics strategy Develop and Deliver analytics solutions (Dashboards, Reports) Develop processes for ongoing reporting deliverables","Hybrid in New York, New York",07/24/2025,Today,"Third Party, Contract",$40 - $50,Easy Apply,Applied
Sr. Data Scientist (STRICTLY OUR W2 and ONSITE -- Do NOT respond if you're looking for REMOTE or C2C),"Infoweb Systems, Inc.",https://www.dice.com/job-detail/0cb8f9a7-c92d-4d02-bc39-af709ce6ca71,"InfoWeb has the following requirement for our direct client, John Deere. Absolutely NO Corp to Corp! Absolutely NO Corp to Corp! Absolutely NO Corp to Corp! We sponsor H1s and s Location: ONSITE in Urbandale, IA Duration: 1+ year to LONG term! Rate: up to $70/hr on OUR W2 As a Data Scientist for John Deere s Intelligent Services Group (ISG), you will join a team leveraging petabyte-scale datasets for advanced analytics and model building to enable intelligent, automated equipment and impro","Urbandale, Iowa",07/25/2025,Today,Contract,Up to $70,Easy Apply,Applied
Lead Data Science With LLM and NLP,InfiCare Technologies,https://www.dice.com/job-detail/15d9d246-00c5-456b-817f-ab5cab932445,"Title-Lead Data Science With LLM and NLP Location-Mason OH Mode Of Hire- Contract Mode Of Work- onsite Role Summary: We are hiring a Senior Data Scientist with deep expertise in AI agent architectures, LLMs, NLP, and hands-on development experience with AXA Protocols and Model Context Protocols (MCP). This role is integral in building interoperable, context-aware, and self-improving agents that interact across clinical, administrative, and benefits platforms. We are looking for Senior Data S","Mason, Ohio",07/23/2025,Today,Third Party,,Easy Apply,Applied
AI/ML SDET,Stellar IT Solutions,https://www.dice.com/job-detail/d9bd6a5d-a220-41ca-9c02-a2c203eb0e8a,"Job Title: AI/ML SDET Job Location: Fort Mill, SC OR Austin, TX Interview: Virtual Job Duration: 6 months C2H Job Summary: We are looking for a Senior SDET with strong automation experience and a passion for cutting-edge technology, especially in the AI/ML space. This role will focus on building robust test automation frameworks and leveraging AI/ML capabilities to improve software quality across platforms. The ideal candidate will be hands-on with Java and Python, REST API testing, and expe","Austin, Texas",07/24/2025,Today,"Full-time, Part-time, Third Party, Contract",USD 55-58,Easy Apply,Applied
AI/ML Engineer,EPSoft Technologies LLC,https://www.dice.com/job-detail/5d578946-b5ea-4e4e-89e1-e08034690d89,"Role: AI/ML Engineer Location: Reston, VA (Onsite role) Duration: Long Term Experience: 8+ years overall in Software Engineering disciplines, preferably in the financial services industry 2-3 years of experience in AI/ML engineering roles Strong programming skills in Python, SQL and experience with AWS. Key Responsibilities: Design, test, and refine prompts for large language models (LLMs) to support financial reporting, summarization, and client communication tools. Analyze structured and un","Reston, Virginia",07/23/2025,Today,"Third Party, Contract",,Easy Apply,Applied
AI Engineer,iTeckSoft INC.,https://www.dice.com/job-detail/0cee91fd-d74f-435c-80df-ce32675a14b5,"No H1 B or OPT candidates Skill sets required Strong communication and collaboration skills.Proven experience with LLMs, prompt engineering, and RAG architecture.Solid understanding of Azure services, including:Azure OpenAIAzure AI SearchAzure FunctionsAPI ManagementWeb App DeploymentGrowing proficiency in .NET 8, C#, and ASP.NET Core.Familiarity with Python is a plus.Experience with DevOps and CI/CD tools.",Remote,07/25/2025,Today,Contract,"$100,000+",Easy Apply,Applied
Data science,"TechniPros, LLC",https://www.dice.com/job-detail/d7ba4da6-6153-4dbe-a1ec-efc1e36617e1,"Job Role : Data scientist (w2 position, day 1 on-site), Must Have AI/ML models using frameworks like ChromaDB, PyTorch, Jira, OpenAI, lanchain, streamlit Experience: Experience Minimum of 10+ years of experience in software engineering or AI/ML development. Technical Skills Lead the development and integration of GenAI solutions across various platforms. Implement AI/ML models using frameworks like ChromaDB, PyTorch, Jira, OpenAI, lanchain, streamlit, etc. Collaborate with cross-functional team","Texas City, Texas",07/24/2025,Today,Contract,,Easy Apply,Applied
Data Scientist,Galax-Esystems Corp,https://www.dice.com/job-detail/a0feb049-d106-439d-9e6d-692edb9f6ebb,Data Scientist Location: Remote Visa: Any visa W2/Fulltime 5+ years of experience only. Analyze large complex datasets to identify trends patterns and correlations using SQL and PythonDevelop and implement machine learning algorithms and models to solve business problems and optimize processesBuild and train deep learning models for tasks such as image recognition natural language processing and recommendation systemsCollaborate with cross functional teams to understand business requirements and,Remote,07/24/2025,Today,"Full-time, Third Party","$80,000 - $100,000",Easy Apply,Applied
Senior AI Engineer,"Phoenix Technology Partners, LLC",https://www.dice.com/job-detail/a0ee3d4c-93da-4682-b6bd-837eca04d010,"Senior AI Engineer Application Development As part of our Technology Applications Development team, you will play a pivotal role in designing, developing, and maintaining applications with Microsoft s AI toolset, including Copilot Studio, Azure AI Services, Power Platform, and full custom development in the M365 ecosystem along with React, and Node.js. Your work will contribute directly to enhancing business process efficiency within the Firm. You will also collaborate with the Innovation Team a","Hybrid in Tampa, Florida",07/23/2025,Today,Full-time,Depends on Experience,Easy Apply,Applied
Data Scientist,Rose International,https://www.dice.com/job-detail/30a97a2a-815a-4b54-aabc-66115e6723b3,"Date Posted: 07/22/2025 Hiring Organization: Rose International Position Number: 485846 Industry: Government/Staffing Job Title: Data Scientist Job Location: Atlanta, GA, USA, 30334 Work Model: Hybrid Work Model Details: 3 day onsite & 2 days remote Shift: Day Employment Type: Temporary FT/PT: Full-Time Estimated Duration (In months): 11 Min Hourly Rate($): 75.26 Max Hourly Rate($): 75.26 Must Have Skills/Attributes: AI Models, Data Scientist, Design, Python, SAS, SQL Experience Desire","Hybrid in Atlanta, Georgia",07/23/2025,Today,Full-time,USD 75.26 per hour,Easy Apply,Applied
Partner Sales Specialist Data & AI Solutions,Quadrant Technologies,https://www.dice.com/job-detail/1a52699d-9383-4abd-a764-8869f64867d9,"Job Summary: We are seeking a Partner Sales Specialist with expertise in Microsoft Fabric, Power BI, Azure Synapse, and AI solutions. In this role, you will drive co-selling and partner enablement strategies focused on data and AI transformation for enterprise clients. Key Responsibilities: Lead co-sell efforts with Microsoft partners across data & AI workloadsEnable partners with technical and sales readiness on Microsoft Fabric and Azure AI servicesSupport partner-driven opportunities through","Redmond, Washington",07/21/2025,Today,Full-time,"$80,000 - $100,000",Easy Apply,Applied
"Data Scientist - AI, Artificial Intelligenc, Agentic,",SES,https://www.dice.com/job-detail/cc486c55-f837-411e-a4ae-5d50895de8f5,"Data Scientist - Agentic AI Type: W2 With Benefits or W2 hourly - No C2C Location: Chantilly, VA Hybrid - Some onsite will be required occasionally Top 5 Technical Skills: Databricks AI tools Snowflake AI tools (new to market) LLMs LangGraph and LangFlow Agentic AI is a PLUS Top Soft Skills: Ability to communicate with users Collaboration Job Description: Key Responsibilities: Machine Learning Development:?Build and optimize machine learning models, including ARIMA, regression, classification m","Hybrid in Reston, Virginia",07/24/2025,Today,Full-time,Depends on Experience,Easy Apply,Applied
Data Science(AI),Diverse Lynx Llc,https://www.dice.com/job-detail/1ad3e98e-874b-4170-8a4b-22ee6f1cf002,"Job Title: Data Science(AI) Location : Jersey City, NJ Experience 8+ RTTO 5 Days Onsite Data Science (AI) - JD Strong Python developerMust have hands on Gen AI","Jersey City, New Jersey",07/16/2025,Today,Contract,Depends on Experience,Easy Apply,Applied
Python AIML with Spanish Speaker-,iPeople Infosystems LLC,https://www.dice.com/job-detail/6c240b19-de65-418e-8cd8-a2a775803ccb,"Role: Python AIML with Spanish Speaker Location: Charlotte, NC 4 (days a week) Type: contract: Exp Level: 4+ Years Primary skills (100%) / experience: We are seeking a highly skilled Senior AI/ML Engineer who is also a native or fluent Spanish speaker to join our growing team. This role requires deep expertise in Python, NLP, and modern AI/LLM techniques. You'll work on building, optimizing, and deploying large language model (LLM) pipelines, including retrieval-augmented generation (RAG), vecto","Charlotte, North Carolina",07/25/2025,Today,Contract,Depends on Experience,Easy Apply,Applied
"Face to Face interview for Azure Data Engineer @ Philadelphia, PA",Saxon Global Inc.,https://www.dice.com/job-detail/8360d895-2a96-42be-909c-fe7b1a1cae27,"I am Mohammed Dastagir with Saxon Global Inc wanted to let you know about the job opportunity for Azure Data Engineer position if interested please share your updated resume along with expecting rate. Must be available for the on-site interview in Philadelphia, PA This is not a mid or junior role we are looking for senior level people here. Title: Azure Data Engineer Location: Remote w/ 1 Monthly on-site meeting to Philadelphia, PA required (University City Section) Must reside in Pennsylvania",Pennsylvania,07/22/2025,Today,Contract,,Easy Apply,Applied
Data Scientist,Sensiple Inc.,https://www.dice.com/job-detail/b71fefec-2ba0-4812-adc1-5e4f73dbf25f,"Sensiple Inc is a New Jersey corporation with over two decades of expertise in technology-driven solutions specialising in Customer Experience, Contact Center Solutions, Digital Transformation, Cloud Computing & Independent Testing. With an expert team that has enriched experience in executing & developing sustainable IT strategies in Healthcare, Technology, Retail, Logistics, Education, Telecommunications, Government and Media, we help our diverse customers to envision the future. By developing","Hybrid in Phoenix, Arizona",07/23/2025,Today,"Contract, Third Party",Depends on Experience,Easy Apply,Applied
Gen AI- BSA,"eTeam, Inc.",https://www.dice.com/job-detail/b5bc353f-240c-4949-b147-91c243c6c79f,"Role Name: Gen AI - BSA Location: San Francisco, CA. Job Description As a Business System Analyst at Lam Research, your focus will be on generating business value by collaborating with business partners. This involves gathering requirements from different business domains such as Engineering, Design, Supply Chain, and Manufacturing, and documenting them as Business Requirement Documents and Functional Requirement Documents. You will have the opportunity to leverage AI technologies to enhance bus","Santa Clara, California",07/22/2025,Today,"Contract, Third Party",Depends on Experience,Easy Apply,Applied
Data Scientist (W2 Contract),Donato Technologies Inc,https://www.dice.com/job-detail/13b16aad-aa62-47dc-9670-6cb2847950c7,"Job Title: Data ScientistLocation: Dallas-Fort Worth (DFW) area Hybrid (2 3 days onsite per week) Duration: 12+ Months Experience: 8+ years Job Description:We are looking for a Data Scientist based in the DFW area to work in a hybrid setup. The ideal candidate will have strong Python scripting skills, experience with Unix/Linux environments, Kafka, and AWS data cloud technologies. This role requires hands-on expertise in building data science models and supporting data migration initiatives. Ke","Hybrid in Dallas, Texas",07/24/2025,Today,Contract,Depends on Experience,Easy Apply,Applied
Gen AI Solutions Architect | Contract | Remote | 15 + Years Only,Anagha Techno Soft,https://www.dice.com/job-detail/e7627ad3-7724-49b2-910a-bf2c25a912e1,"Position: Gen AI Solutions Architect Location: Remote Duration: 12 Months 15+ Years Only Required Skills: Architectural/technical experience with Gen AI (RAG/chain frameworks, Vector DB searches and embeddings, Agentic AI, etc.)Architectural/technical expertise with cloud especially Google Cloud Platform, Azure, AWS (native, cloud agnostic, container, etc offerings) and cloud/SAAS systems integration.Experience designing REST APIs that facilitate a strong developer experience or simplify systems",Remote,07/24/2025,Today,Contract,Depends on Experience,Easy Apply,Applied
Principal Engineer with AI/ML- Need Local to CA,Amaze Systems Inc,https://www.dice.com/job-detail/59d68917-5506-4706-ae23-0af18b758c4e,"Principal Engineer with AI/ML- Need Local TO CA Location : Woodland Hills , CA - 5 Days On-Site Mandatory Areas Must have Skills Skills - We need Lead with 15+ years' experience. Skill 1 9+ Yrs of Exp Java-based microservices Spring Boot, Spring Cloud, and Hibernate (Java Software Developer) Skill 2 7+ Yrs of Exp Natural Language Systems (NLS), integrating with NLP APIs, LLMs, and AI models Skill 3 9 Yrs of Exp Relational database (PostgreSQL, MySQL) and NoSQL databases (MongoDB, Elasticsearch)","Los Angeles, California",07/17/2025,Today,"Third Party, Contract",,Easy Apply,Applied
AI/ML Engineer,Siri Infosolutions Inc,https://www.dice.com/job-detail/52e5148f-ead8-41bf-8814-0c9282dde8d7,"Special Comments: We have 1 Requirement for Native Spanish speaking candidate with (Written/Reading/Speaking) GenAI/Agentic AI engineer. Job Title: AI/ML GenAI/Agentic AI Senior Engineer Work Location: St. Louis, MO and/or Denver CO and/or Charlotte NC (Day One Onsite) Duration: Long Term Required Skills: 8+ years overall experience, including 4+ years in AI/ML Proficiency in Python, ML, NLP, and text data analysis Hands-on experience with API creation, RAG, Vector databases, LLM prompt eng","Denver, Colorado",07/23/2025,Today,"Contract, Third Party",,Easy Apply,Applied
Data Scientist-Python SQL Big Data Platforms-Hybrid,Elite Technical,https://www.dice.com/job-detail/230c2825-f9c2-456a-a5b4-ca9938cd3965,"Absolutely no third parties please !! Responsibilities Our Client is seeking a Data Scientist to Analyze complex datasets to uncover patterns, trends, and insights that drive strategic business decisions. Develop predictive models, machine learning algorithms, and statistical analyses to solve business problems and improve campaign or operational performance. Collaborate with business and technical teams to define data science use cases and translate business requirements into analytical soluti","Hybrid in Alpharetta, Georgia",07/22/2025,Today,Contract,$75 - $80,Easy Apply,Applied
"Data Scientist (SQL,Python, AI/ML) - Remote",FlairTech Solutions,https://www.dice.com/job-detail/fda02b78-1ee7-4511-b701-c8c4b1890125,Role: Data Scientist Location: Remote NOTE: Must have valid LinkedIn ID (Created on or before 2017). Strong exp must in SQL and Python. Strong exp in AI/ML and LLM.,Remote,07/17/2025,Today,"Contract, Third Party",Depends on Experience,Easy Apply,Applied
"Data Scientist (W2, Remote)",Raas Infotek LLC,https://www.dice.com/job-detail/00b42a3e-3e0b-4b5e-af48-97e96af0cd2c,"Job Title: Data Scientist (W2, Remote)Employment Type: Full-time, W2Location: Remote (U.S.-based) Job Description:We are seeking a skilled and motivated Data Scientist to join our team remotely. The ideal candidate will have a strong foundation in data analysis, machine learning, and statistical modeling, with hands-on experience in real-world data applications. Responsibilities: Develop and deploy predictive models and machine learning algorithms Analyze large datasets to extract insights and s",Remote,07/23/2025,Today,Contract,Depends on Experience,Easy Apply,Applied
Job Opportunity for Data Scientist,Proventus Metrics,https://www.dice.com/job-detail/49aec25b-2533-468c-95d7-df953b5bc3af,"Job Title: Data ScientistExperience: 3 5 years (preferred) Key Skills: Predictive modeling Gradient boosting (e.g., XGBoost, LightGBM) Basic data engineering collaboration Python/R and SQL Role: Build predictive models, work with data engineers, and provide data-driven insights.",Remote,07/24/2025,Today,Full-time,"$40,000 - $60,000",Easy Apply,Applied
Data Scientist -- Azure and ML!- W2 (H1B/OPT) Accepted,Xcelo Group Inc,https://www.dice.com/job-detail/f5baea5b-1764-4372-b0ca-4ba3defa98b4,"Job Title: Data Scientist -- Azure and ML Full-time Location: Dallas, TX (Remote) Duration: Long Term Experience: 5-10 Years We're searching for a skilled Data Scientist with expertise in Azure and Machine Learning (ML) to design, develop, and deploy data-driven solutions. You'll collaborate with data engineers, developers, and product managers to build and optimize predictive models and analytics solutions. Responsibilities: Design, develop, and deploy machine learning models and data pipel","Remote or Dallas, Texas",07/25/2025,Today,"Full-time, Part-time, Contract, Third Party",USD 60-70,Easy Apply,Applied
Java Full Stack Developer (GenAI & Python Experience) Only W2,FutureTech Consultants LLC,https://www.dice.com/job-detail/75660d07-d4a8-4467-bd8d-45c0fd0e3d15,"Job Title: Java Full Stack Developer (GenAI & Python Experience) Location: Remote About the Role: We are seeking a skilled Java Full Stack Developer with hands-on experience in Generative AI (GenAI) tools and Python development to join our fast-growing remote engineering team. You ll play a key role in building scalable web applications, integrating AI capabilities, and contributing to end-to-end software delivery from backend APIs to frontend experiences. Key Responsibilities: Design and devel",Remote,07/18/2025,Today,Contract,$1 - $1,Easy Apply,Applied
