title,company,link,description,location,date_added,date_posted,job_type,salary,apply_text,status
Java Developer with Gen AI,INNOVIT USA INC,https://www.dice.com/job-detail/fae590a4-d083-4908-bd78-83f7d55f3d70,"Hiring: W2 Candidates Only Location: USA Visa: Open to any visa type with valid work authorization in the USA Experience Required: 6 to 12 years Level: Mid to Lead positions Responsibilities: Lead the design, development, and deployment of Java-based applications incorporating Generative AI solutions. Leverage GitHub Copilot to improve development speed and code quality, serving as a mentor for team members on best practices. Collaborate with data scientists and AI engineers to integrate AI mode","Harrisburg, Pennsylvania",07/21/2025,Today,"Full-time, Part-time, Contract, Third Party",,Easy Apply,Applied
"Senior Gen-AI Tester (Need local to Virginia , DC and Maryland)",TalTeam,https://www.dice.com/job-detail/e6cab37a-83fc-4f29-810f-cf0f8ea66fc6,"Senior GenAI Tester/ Gen AI Testing Location: Reston, VA (Mostly remote, but DMV candidates preferred for onsite meetings) Must-Have Skills 1. Gen AI Testing: 1 3 years of hands-on experience. 2. LLMs (Large Language Models): Practical experience required. 3. Compass: Familiarity and usage experience. 4. AWS Kendra: Must have worked with this search service. 5. Python Automation: Strong scripting and automation skills using Python. Experience Level 10+ years in QA/testing roles. Technical Lead L",Remote,07/24/2025,Today,"Contract, Third Party",Depends on Experience,Easy Apply,Applied
ML Engineer,Apex Systems,https://www.dice.com/job-detail/a302b2d9-7d86-41af-8a12-f0d90b664715,"Job#: 2081725 Job Description: Role Overview: Design, develop, and deploy advanced ML and generative AI solutions (e.g., RAG, image generation) using LLMs, prompt engineering, and MLOps best practices. Collaborate across teams to integrate Azure, Snowflake, and other technologies into scalable, secure AI applications. Key Responsibilities: Build generative AI systems using Azure OpenAI, Cognitive Search, and Snowflake Cortex.Fine-tune LLMs/SLMs using techniques like RLHF and prompt tuning.Dev","Cleveland, Ohio",07/16/2025,Today,Full-time,,Easy Apply,Applied
Senior Data Engineer,TUPPL Technology Inc,https://www.dice.com/job-detail/bf0a0023-8ac6-4a43-af99-61e5ee129a85,"Position Title: Senior Data Engineer salary: $140K Maximum Number of Roles: 5 Priority High Location: Cleveland, OH (Preferred) or Pittsburgh, PA (3 Days Office) open to relocate, will work too Job Duties : 10+ Years experience working in Data Engineering and Data Analysis.Hands on Experience in Hadoop Stack of Technologies ( Hadoop ,PySpark, HBase, Hive , Pig , Sqoop, Scala ,Flume, HDFS , Map Reduce).Hands on experience with Python & Kafka .Good understanding of Database concepts , Data Design","Hybrid in Cleveland, Ohio",07/21/2025,Today,Full-time,"$140,000 - $160,000",Easy Apply,Applied
Data Scientist,"TekLeaders, Inc",https://www.dice.com/job-detail/fcb9ba92-a80c-4a1d-996d-ca5517e2299f,"Data Scientist SWA Dallas office, TX (onsite) Rate Only W2 Job Description: Data Scientist We are seeking a skilled and motivated Data Science Supervisor to lead a team of data scientists and analysts in delivering impactful insights and data-driven solutions. The ideal candidate will have a strong background in data science, machine learning, and statistical analysis, paired with excellent leadership and project management skills. This role requires the ability to manage projects, mentor te","Dallas, Texas",07/17/2025,Today,"Full-time, Part-time, Third Party, Contract",,Easy Apply,Applied
"GEN AI - 5+yrs - Charlotte, NC -Onsite",iMedhas Consulting Services,https://www.dice.com/job-detail/3b5a29c8-31c7-43f2-a065-f35d44cfce6b,"Job Description Experience Minimum of 5+ years of experience in software engineering or AI/ML development. Technical Skills Lead the development and integration of GenAI solutions across various platforms. Implement AI/ML models using frameworks like ChromaDB, PyTorch, Jira, OpenAI, lanchain, streamlit, etc. Collaborate with cross-functional teams to align technical solutions with business goals. Deploy and monitor LLMs and generative models in production environments. Ensure compliance with clo",North Carolina,07/23/2025,Today,"Third Party, Contract",Depends on Experience,Easy Apply,Applied
Data Scientist with Gen AI,INNOVIT USA INC,https://www.dice.com/job-detail/0bd7f69e-ace6-4ad2-900f-4851e58d6f06,"Hiring: W2 Candidates Only Location: USA Visa: Open to any visa type with valid work authorization in the USA Experience Required: 6 to 12 years Level: Mid to Lead positions Key Responsibilities Data Analysis & Modeling: Analyze large datasets to identify patterns and trends, developing predictive models using ML algorithms like regression, classification, and clustering. AI Model Development: Design, train, and deploy AI models, including natural language processing (NLP) systems, computer visi","Jackson, Mississippi",07/22/2025,Today,"Full-time, Part-time, Third Party, Contract",,Easy Apply,Applied
AIOps Engineer(Devops with AI/ML),Intento Analytics LLC,https://www.dice.com/job-detail/bee7f16c-5406-4477-a686-fa511ad51992,"Job Description: We are looking AIOps Engineer (An experienced SRE with knowledge of how to implement AI/ML). Must Have Skills Machine Learning: 8+ YearsAI Frameworks(e.g., TensorFlow, PyTorch, scikit-learn): 5+ YearsMonitoring & Observability Tools(e.g., Splunk, Prometheus, Grafana, ELK Stack): 5+ YearsPython: 5+ YearsCloud: 5+ YearsDevOps / SRE: 5+ YearsOptional Skills:Product Owner : 3+ Years Required Skills and Qualifications:Strong experience with AI/ML frameworks and tools (e.g., TensorFl","Frisco, Texas",07/15/2025,Today,"Contract, Third Party",$50 - $60,Easy Apply,Applied
Data Scientist,Better Future Solutions,https://www.dice.com/job-detail/2a4f0c9d-055f-407e-bd73-4f9cc4d10fd0,"Position: Data Scientist Location: Atlanta, GADuration: 10 months+ Responsibilities Collect, clean, and analyze large, complex datasets from multiple sources. Develop predictive models and machine learning algorithms to support decision-making and improve business performance. Translate business problems into data-driven solutions with measurable impact. Develop and deploy machine learning models to detect, predict, and prevent fraudulent transactions and behavior patterns.Analyze large volume","Hybrid in Atlanta, Georgia",07/22/2025,Today,Contract,Depends on Experience,Easy Apply,Applied
Java Developer with Gen AI,INNOVIT USA INC,https://www.dice.com/job-detail/3616e16d-d8d7-4475-88e6-180080d865ed,"Hiring: W2 Candidates Only Location: USA Visa: Open to any visa type with valid work authorization in the USA Level: Mid to Lead positions Job Details Artificial Intelligence (Required) Knowledge of Generating Artificial Intelligence (AI), Machine Learning (ML), and Large Language Models (LLMs). Understanding of text processing, tokenization, sentiment analysis, and language models like GPT or BERT Understanding of supervised, unsupervised, and reinforcement learning. Familiarity with ML algor","Salem, Oregon",07/25/2025,Today,"Full-time, Part-time, Third Party, Contract",,Easy Apply,Applied
Machine Learning Engineer (Hybrid),MCS Group,https://www.dice.com/job-detail/d05565c3-4b11-44c0-ba5a-85e1aa6776d6,"MCS is thrilled to be partnering with a global financial institution in NYC, as they look to add to their growing Machine Learning team. We're looking for a sharp, hands-on engineer with a passion for greenfield development and building products from scratch. If you're excited about large language models (LLMs), classic ML techniques, and building tools that power a multi-billion dollar enterprise, this role is for you. This team acts more as a startup within a financial institution, so experi","New York, New York",07/22/2025,Today,Full-time,$200000.00 - $250000.00 per annum,Easy Apply,Applied
Gen AI Engineer,Cygnus Professionals,https://www.dice.com/job-detail/cadf61bb-ac1c-43e1-a7b6-12649cb1c757,"Position Title : Gen AI EngineerDuration : 12+ months with Possible Extension/Full timeLocation : NJ/TX/VA Mandatory Qualifications: Strong proficiency in Python. Expertise in FastAPI for backend development. Experience with LangChain and LangGraph Hands-on experience with Retrieval-Augmented Generation (RAG) Proficiency in vector databases (Milvus, FAISS, or similar) Database integration (MongoDB/PostgreSQL, GraphDB) Experience integrating AWS Bedrock models Desired Qualifications: Prompt en","Jersey City, New Jersey",07/17/2025,Today,Full-time,Depends on Experience,Easy Apply,Applied
AI/ML Engineer (NLP Specialist),"NTT DATA Americas, Inc",https://www.dice.com/job-detail/8511120c-7d17-4d27-9ecf-efe7cbaed80e,"Company Overview: Req ID: 333095 NTT DATA strives to hire exceptional, innovative and passionate individuals who want to grow with us. If you want to be part of an inclusive, adaptable, and forward-thinking organization, apply now. NTT DATA's Client is currently seeking an AI/ML Engineer (NLP Specialist) to join their team in Irving, Texas (US-TX), United States (US). Job Description: ""Job Duties: Team/Role Overview: We are seeking a highly skilled and experienced AI/ML Engineer to play a critic","Irving, Texas",07/15/2025,Today,Contract,BASED ON EXPERIENCE,Easy Apply,Applied
Senior Gen AI Solutions Architect,"VDart, Inc.",https://www.dice.com/job-detail/b3811e1c-f0e0-460f-983d-a81709fd6cab,"Job Title: Senior Gen AI Solutions Architect Location: Austin/Dallas/Frisco, TX (Hybrid) Duration / Term: Full-Time Job Description We are seeking a visionary and technically adept Senior Generative AI Solutions Architect to lead the design and delivery of advanced GenAI and Agentic AI solutions across diverse industries including finance, healthcare, manufacturing, automotive, and energy. This role requires deep expertise in LLMs, AI architecture, and stakeholder engagement, with a strong foc","Hybrid in Dallas, Texas",07/16/2025,Today,Full-time,Depends on Experience,Easy Apply,Applied
Sr. Machine Learning Engineer // No C2C,Ekcel Systems,https://www.dice.com/job-detail/c8b94c4f-6682-401c-aa76-8c990f87ceb7,"Hi,Hope you are doing well. We do have the below position. Position: Sr. Machine Learning EngineerLocation: Any where in USNO C2C *Text Embeddings & NLP*- Design and implement pipelines leveraging text embeddings for semantic search, classification, clustering, and document retrieval.- Work with embedding techniques such as TF-IDF, Word2Vec, GloVe, FastText, and transformer-based models including BERT, Sentence-BERT, OpenAl, and Azure Open embeddings.- Apply dimensionality reduction methods (PCA","Plano, Texas",07/18/2025,Today,Contract,$60+,Easy Apply,Applied
ML Engineer,"Pyramid Consulting, Inc.",https://www.dice.com/job-detail/61aa5f21-f75e-469e-9ba8-d8490b1cebf7,"Immediate need for a talented ML Engineer. This is a 10+months contract opportunity with long-term potential and is located in New York City,NY(Hybrid). Please review the job description below and contact me ASAP if you are interested. Job ID:25-78380 Pay Range: $80 - $95/hour. Employee benefits include, but are not limited to, health insurance (medical, dental, vision), 401(k) plan, and paid sick leave (depending on work location). Key Requirements and Technology Experience: Key Skills:Over 5","Hybrid in New York, New York",07/17/2025,Today,Contract,$80 - $95,Easy Apply,Applied
GenAI Architect,STAFFWORXS LLC,https://www.dice.com/job-detail/792311cd-c11a-490c-b911-2ea74671f345,"Now Hiring: GenAI Architect (2 Open Roles) Location: Remote Duration: 6 Months (Contract) We re actively looking for 2 experienced GenAI Architects to help drive innovation by leveraging AI capabilities within enterprise applications to meet real business outcomes. This is a unique opportunity to work on cutting-edge AI/Agentic solutions across multiple platforms and ecosystems. Key Responsibilities: Architect intelligent solutions using AI features in platforms like Salesforce, Outreach, Gon",Remote,07/24/2025,Today,Contract,$60 - $70,Easy Apply,Applied
Senior Google Cloud Platform Data Engineer,Exatech Inc,https://www.dice.com/job-detail/79345845-8b9b-42e1-a762-cf1a4c896351,"Role: Google Cloud Platform Data Engineer Location: SFO, CA Duration: 12+ Months Interview: Video Job Description: Qualifications: Education: Bachelor's or Master's degree in Computer Science, Information Systems, or a related field. Experience: Minimum of 7-8 years of experience in data engineering, with a focus on data architecture and pipeline development. Proven experience with cloud platforms (Google Cloud Platform) and big data technologies (e.g., Airflow, Spark, DBT, Databricks. BigQ","San Francisco, California",07/16/2025,Today,"Contract, Third Party",,Easy Apply,Applied
Solution Architect - Gen AI,Jubilant Consulting,https://www.dice.com/job-detail/faff1f64-3ce0-429c-8a78-a93578eb407f,"Job Title: Solution Architect - Gen AI Location: NJ, Jersey City/Atlanta Key Responsibilities We are looking for a highly experienced and hands-on Solution Architect with over 10 years of expertise in building scalable, enterprise-grade frameworks and foundational services to support next-generation Generative AI solutions. Lead and mentor a team of engineers working on full stack development of GenAI foundational services and framework. Architect and implement scalable and reusable infrastruct","Jersey City, New Jersey",07/15/2025,Today,"Third Party, Contract",$60 - $70,Easy Apply,Applied
Java Lead with AI/ML,Galent,https://www.dice.com/job-detail/69525e29-606f-44f9-a9bb-210cc0adb5a7,"Title: Java Lead with AI/ML Location: Woodland Hills, CA Onsite 3 days Type : Contract We are seeking an experienced Technical Lead -Java with a strong background in Spring Boot and Natural Language Systems (NLS) to join our dynamic team. The ideal candidate will design, develop, and optimize scalable Java applications while integrating advanced NLP, AI, and machine learning models into our platform. Key Responsibilities: Develop and maintain Java-based microservices using Spring Boot, Spring","Los Angeles, California",07/16/2025,Today,"Third Party, Contract",Depends on Experience,Easy Apply,Applied
Google Cloud Platform Data Engineer,Exatech Inc,https://www.dice.com/job-detail/64a3a4d5-0d45-4d56-8106-59ef53565c64,"Role: Google Cloud Platform Teradata Engineer Location: Hartford, CT (Hybrid, Locals preferred) Duration: 12+ months Interview: Video Job Description: We are seeking a skilled Data Engineer to support a high-impact enterprise data migration initiative. The goal is to migrate data warehouse assets and ETL pipelines from Teradata to Google Cloud Platform (Google Cloud Platform). The role involves hands-on development, testing, and optimization of data pipelines and warehouse structures in Goog","Hartford, Connecticut",07/15/2025,Today,"Contract, Third Party",,Easy Apply,Applied
State of Georgia Data Scientist - Hybrid - W2,Infinity Tech Group Inc,https://www.dice.com/job-detail/b49b00a8-4a59-43fd-8149-33efd4bc8bc5,"We are seeking a highly analytical and detail-oriented Data Scientist with experience in Risk and Fraud analytics to join our growing team. This role will focus on developing and deploying machine learning models, statistical methods, and data-driven strategies to detect risky behaviours and prevent fraudulent activities across our products and services. Key Responsibilities Collect, clean, and analyze large, complex datasets from multiple sources. Develop predictive models and machine learnin","Atlanta, Georgia",07/22/2025,Today,Contract,Depends on Experience,Easy Apply,Applied
Generative AI Architect,ConglomerateIT,https://www.dice.com/job-detail/efc9a6f6-ea9c-4011-84ee-10be3a19ff25,Job Title: Generative AI Architect Tax Term: W2/1099 Only Location: Remote Employment Type: Contract About us Conglomerate IT is a certified and a pioneer in providing premium end-to-end Global Workforce Solutions and IT Services to diverse clients across various domains. Visit us at Our mission is to establish global cross culture human connections that further the careers of our employees and strengthen the businesses of our clients. We are driven to use the power of global network to con,"Hybrid in Dallas, Texas",07/17/2025,Today,Contract,,Easy Apply,Applied
Python Developer AI & Data Science,Synechron,https://www.dice.com/job-detail/a854d9c8-8d08-45fb-8e4a-f3b74199cc00,"We are At Synechron, we believe in the power of digital to transform businesses for the better. Our global consulting firm combines creativity and innovative technology to deliver industry-leading digital solutions. Synechron s progressive technologies and optimization strategies span end-to-end Artificial Intelligence, Consulting, Digital, Cloud & DevOps, Data, and Software Engineering, servicing an array of noteworthy financial services and technology firms. Through research and development in","Weehawken Township, New Jersey",07/22/2025,Today,Full-time,"$120,000 - $140,000",Easy Apply,Applied
LLM Engineer | GenAI Architect | Google Cloud | Vertex AI | RAG | AI Agents,Hexacorp,https://www.dice.com/job-detail/48036d80-50e0-44ac-99db-da7c52e2f4e9,"We're seeking an LLM Engineer to lead the design, fine-tuning, and deployment of domain-specific GenAI and AI agent solutions using Google Cloud Platform and open-source frameworks. What You'll Do: Build & deploy LLM-powered AI agents for procurement automation Fine-tune foundation models (LoRA, PEFT, adapter tuning) Engineer prompts and implementRAG pipelines UseLangChain, Hugging Face, Vertex AI, LangGraph Develop robust MLOps & inference pipelines Work closely with stakeholders to shape AI st",Remote,07/15/2025,Today,"Full-time, Third Party",$70 - $90,Easy Apply,Applied
Data science,"TechniPros, LLC",https://www.dice.com/job-detail/924e92f2-8a08-49eb-82c4-598bb65703c0,"Job Title: Data Scientist AI/ML Location: Domain: Long Term Contract Looking for W2 Candidates. No C2C Job Summary: We are seeking a highly skilled and analytical Data Scientist to join our team. You will be responsible for leveraging data to drive business insights, develop predictive models, and support data-driven decision-making across departments. The ideal candidate is proficient in data mining, statistical modeling, machine learning, and data visualization techniques. Responsibilities","Bentonville, Arkansas",07/25/2025,Today,Contract,,Easy Apply,Applied
Senior Data Scientist (Reinforcement Learning must have),InfoObjects Inc,https://www.dice.com/job-detail/22c85a6d-0dd2-4364-9175-de424091959e,"Senior Data Scientist (Reinforcement Learning must have) Location: 100% Remote Duration: 6 Months contract Reinforcement Learning (RL) Skill Set Understanding of Sequential Decision MakingRL focuses on agents making a series of decisions to maximize cumulative reward.Requires knowledge of Markov Decision Processes (MDPs), policy/value functions, and Bellman equations.Algorithmic Expertise in RLFamiliarity with algorithms like:Q-learning, SARSADeep Q-Networks (DQN)Policy Gradient methods (REINFO",Remote,07/18/2025,Today,Contract,Depends on Experience,Easy Apply,Applied
Data Scientist,CCS Global Tech,https://www.dice.com/job-detail/321c5b94-1043-4fd4-956c-a7ad5cdf14c0,"CCS Global Tech is a rapidly growing Information Technology company with a diverse portfolio of technology products and services and a large network of industry partnerships. With over 22 years of being a successful business with a global talent pool and presence, CCS is a certified Microsoft Gold Partner and specializes in delivering expert Microsoft based solutions for technical and business needs. We have been recognized by Inc. 500 Magazine as one of the fastest growing small companies in th","Bethesda, Maryland",07/15/2025,Today,Full-time,Compensation information provided in the description,Easy Apply,Applied
AI Engineer,Mokshaa LLC,https://www.dice.com/job-detail/0bedacdd-401d-4b40-8089-5aea4d56d441,"Role: AI Engineer Location: Lake Mary, FL / Pittsburgh, PA (Day 1 Onsite) Pay Rate Range: $65/hr to $70/hr Job Description: This role involves developing and implementing AI solutions, working closely with cross-functional teams, and contributing to the advancement of our AI capabilities 4-6+ years of experience in AI development and machine learning. Proven track record of successfully delivering AI solutions in a professional setting. Strong understanding of data structures, algorithms,","Lake Mary, Florida",07/21/2025,Today,"Full-time, Part-time, Contract, Third Party",USD 65,Easy Apply,Applied
AI Specialist,Boston Associate Software Systems,https://www.dice.com/job-detail/f8c7ba73-01bd-4fea-a5d0-fd8490ce37f2,"Proficient in large language models with expertise in any one of the leading LLMs Chatgpt, Claude, Gemini etc.Experience creating at least 1 production grade AI Agents for any of the use caseShould have experience implementing AI solution to analyze texts, extract key information, interact with database, and take actions per business workflowExperience integrating AI agents into existing business processes and workflow","Dallas, Texas",07/18/2025,Today,"Contract, Third Party",Depends on Experience,Easy Apply,Applied
Google Cloud Platform Data Engineer-Must be on our w2,"Xylo Technologies, Inc.",https://www.dice.com/job-detail/eac7391a-b283-4faa-984f-c874020f9554,"Title: Google Cloud Platform Data Engineer Duration: Until 12/31/2025 Remote Scope: Develops and deploys data pipelines, integrations and transformations to support analytics and machine learning applications and solutions as part of an assigned product team using various open-source programming languages and vended software to meet the desired design functionality for products and programs. The position requires maintaining an understanding of the organization's current solutions, coding langua",Remote,07/22/2025,Today,Contract,Depends on Experience,Easy Apply,Applied
"AI Specialist/Consultant with 12+ years (Need Locals only, F2F required)","M3BI, LLC.",https://www.dice.com/job-detail/0b27abf8-d8ba-498b-be8b-e99928bdfb51,"10years of experience in strategic AI implementation specializing in customer machine learning solutions, predictive and prescriptive solutions, prompt engineering, AI Agents (at least one production grade implementation) etc. Key skills required are: Proficient in large language models with expertise in any one of the leading LLMs Chatgpt, Claude, Gemini etc. Experience creating at least 1 production grade AI Agents for any of the use case Should have experience implementing AI solution to anal","Dallas, Texas",07/18/2025,Today,"Contract, Third Party",Depends on Experience,Easy Apply,Applied
AI/ML Engineer,Unisys,https://www.dice.com/job-detail/33e260b5-29dc-4513-8d8c-e2b30c11c081,"Description:Experience: * 8+ years overall in Software Engineering disciplines, preferably in the financial services industry * 2-3 years of experience in AI/ML engineering roles * Strong programming skills in Python, SQL and experience with AWS.Key Responsibilities: * Design, test, and refine prompts for large language models (LLMs) to support financial reporting, summarization, and client communication tools. * Analyze structured and unstructured financial data using Python and SQL, delivering","Reston, Virginia",07/18/2025,Today,"Full-time, Contract",BASED ON EXPERIENCE,Easy Apply,Applied
Agentic AI Developer,SSTech LLC,https://www.dice.com/job-detail/1e1768e2-4ecc-4bf3-a366-02b7c0364e38,"Role: Agentic AI Developer - Irving TX Hybrid ( 3 days onsite is must (No remote option)) Note - Preferred telecom background but not a must, someone with solid Agentic architecture Background, someone solid in comm. skills and trade failure experience is a big plus. 1st Round: 2 Coding Q's and scenario based questions 2nd Round: High level topics on Agentic AI, Gen AI with Scenario based topics. D. Trade Failures Build New (1 Developer) What it means: Trade Failures involve issues during the","Hybrid in Irving, Texas",07/18/2025,Today,Contract,$50+,Easy Apply,Applied
AI ML - Lead Engineer,Spar Information Systems,https://www.dice.com/job-detail/2595b99a-60e2-4ea9-8c76-a6d10739225a,"Hello Everyone, Hope you are doing good My name is Pavan and I work with SPAR Information System., I have a great opportunity for you, please find the job details below, if you are interested in applying please send me your updated resume and best time for you to discuss about this opportunity in details. Location: Bellevue, Washington Duration: Fulltime position Development and Integration: Responsible for incorporating large language models (LLM) into various applications. This includes devel","Bellevue, Washington",07/18/2025,Today,"Full-time, Part-time, Third Party, Contract",,Easy Apply,Applied
Python Data Engineer - W2 - Need NJ Locals,Saksoft,https://www.dice.com/job-detail/cf0b00ad-b73d-4e28-9c02-a1ce783fe155,"Position: Mid-Level Python Data Engineer Locations: Iselin, NJ (Only Locals, 3 days a week in any location) Contract: 2-year contract Interview process: one and done video interview Must have: 7+ years of Python Development, SQL, and data manipulation libraries (e.g., Pandas, NumPy), strong understanding of data governance, model validation, and regulatory compliance, and Oracle Database Experience. **Huge NICE TO HAVE Transaction monitoring/AML domain knowledge** Role Description: We are seeki","Hybrid in Woodbridge Township, New Jersey",07/21/2025,Today,Contract,Depends on Experience,Easy Apply,Applied
