title,company,link,description,location,date_added,date_posted,job_type,salary,apply_text,status
MLOps Engineer (Google Cloud Platform Specialization),"E-Solutions, Inc.",https://www.dice.com/job-detail/202b3b73-2367-4d4c-a373-5be181c92165,"Job title: MLOps Engineer (Google Cloud Platform Specialization) Location: Nashville TN /Malvern, PA (onsite) Mandatory Skills: Google Cloud Platform,Python,MLOps, Gen AI RAG What is in it for you? The MLOps Engineer (Google Cloud Platform Specialization) is responsible for designing, implementing, and maintaining infrastructure and processes on Google Cloud Platform (Google Cloud Platform) to enable the seamless development, deployment, and monitoring of machine learning models at scale. Th","Nashville, Tennessee",07/28/2025,Today,Third Party,,Easy Apply,Pending
GenBI data analytics consultant - onsite,"iTek People, Inc.",https://www.dice.com/job-detail/54656e41-c909-4f16-bd57-4ba7890e3d3a,"Hi All, we have an urgent Requirement for GenBI Data Analytics Consultant Location; Hybrid (2 3 days/week on-site in West Sacramento, CA) Duration; 12 months with a possible 12-month extension Required Skills; The GenBI Data Analytics Consultant will support in modernizing the Business Intelligence (BI) and Data Warehouse (DW) platforms by integrating Generative BI (GenBI) and agentic AI capabilities. The role is part of a strategic initiative to advance client's analytics maturity through A",California,07/28/2025,Today,"Third Party, Contract",Depends on Experience,Easy Apply,Pending
Gen BI Analytics Consultant,"iTek People, Inc.",https://www.dice.com/job-detail/f859cabb-5d4b-46b2-84ec-cf8a41ab45b0,"Role: Gen BI Analytics Consultant Location: Sacramento, CA Experience: 12+ Job Description: Key Responsibilities: Collaborate with business units to evaluate and document at least five high-impact GenBI use cases Conduct ROI, feasibility, and risk assessments to prioritize BI/GenBI initiatives Develop requirement documents including goals, data inputs, outcomes, and acceptance criteria Perform architecture review of existing BI/DW platforms and define a roadmap to a GenBI-enabled platform Desi",Hybrid in California,07/28/2025,Today,"Contract, Third Party",Depends on Experience,Easy Apply,Pending
Sr. AI Engineer,"eSolutionsFirst, LLC",https://www.dice.com/job-detail/a042acbd-14cb-4dac-9d4d-01572519ef41,"Description: We re building smart, scalable, AI-native products and we re looking for a Senior Python Developer who s excited to shape the next generation of intelligent systems. You ll work at the intersection of backend engineering, LLM agents, and automation, using tools like LangChain, OpenAI, and FastAPI to ship real-world features fast. Design & integrate LLM agents using frameworks like LangChain, AutoGen, or HaystackDeploy apps to AWS/Azure using Docker, Kubernetes, TerraformCollaborate","McLean, Virginia",07/28/2025,Today,Full-time,"$140,000 - $160,000",Easy Apply,Pending
"AI Project / Product Manager with MLOps, and DevOpS",Amaze Systems Inc,https://www.dice.com/job-detail/6788e8ad-f6a3-4a75-9c7b-99b9b93c80c2,"Hello, Hope you are doing well, Position: AI Project / Product Manager Location: WOODLAND HILLS, CA / Mason, OH Must have Skills Skill 1 10+ Yrs of Exp AI product development workstreams Skill 2 7+ Yrs of Exp data science, LLM/NLP engineering, ML Ops, and DevOpS Skill 3 9 Yrs of Exp Familiarity with healthcare data environments, including HIPAA, PHI, payer systems, or healthcare benefit Skill 4 6 Yrs of Exp - Proficiency with project tracking tools such as Jira, Azure DevOps, Confluence, an","Los Angeles, California",07/28/2025,Today,"Third Party, Contract",,Easy Apply,Pending
AI Solutions Architect - Remote,Nava Software Solutions,https://www.dice.com/job-detail/77aaac95-371a-47f3-bd18-164476da48ed,"NAVA Software solutions is looking for a AI Solutions Architect Details: AI Solution Architect Insurance Domain (Azure & AWS) Location: Remote Duration: 12 months Role Overview As an AI Solution Architect specializing in Azure and AWS, you will lead the design, development, and production deployment of large-scale AI/ML solutions tailored for the insurance industry. You will work closely with cross-functional teams including data scientists, engineers, actuaries, and business leaders to tran","Remote or Jersey City, New Jersey",07/28/2025,Today,"Third Party, Contract",,Easy Apply,Pending
Contact Center Data and AI Architect,Jubilant Consulting,https://www.dice.com/job-detail/1d984d1e-281e-4b36-9f2f-03f79f27f5a5,"Candidate must have Deep knowledge of Genesys (InfoMart, UCS, GAAP, SpeechMiner, WFM, Routing, etc.) and Five9 data ecosystem Having knowledge on contact center migration to CCaaS and build data solution surrounding the migration Define data strategy for migrating historical and real-time data to the cloud while ensuring minimal disruption to downstream systems. Understand data models for Genesys (InfoMart, SpeechMiner) and develop mappings to cloud equivalents. Collaborate with data architects","Phoenix, Arizona",07/28/2025,Today,"Third Party, Contract",$70 - $80,Easy Apply,Pending
QA Engineer - AI/ML,Aroha Technologies,https://www.dice.com/job-detail/d453d1fb-a29a-415b-8657-9468bea799ac,"Job Description: Job Title: QA with Generative AI Experience : 8 - 11 Yrs | Gen AI/ AI Exp : 2+ Years Location: Hartford, CT Working Model: Hybrid Objective : Oversee development testing strategies and framework for AI led solutions. Role Objectives: Test & Validate the functionality and accuracy of AI-generated outputs Expectations: Working closely with the development team to design test cases, execute test scenarios, and identify potential data-related issues in the AI models Contribut","Hartford, Connecticut",07/28/2025,Today,"Contract, Third Party",,Easy Apply,Pending
AI/ML Engineer End-to-End AI Platform,SYSTEM SOFT TECHNOLOGIES LLC,https://www.dice.com/job-detail/db0c8abf-a6cc-4cbc-a26c-61d26f0d9a24,"AI/ML Engineer End-to-End AI Platform Duration: 4 months Key Skills: Azure, MLOps, Data Lake, Docker, AKS, Cloud AI Platforms Minimum 5 years of experience as a Data Scientist, with at least 2 years focused on machine learning engineering in cloud environments.Proven experience deploying ML models in Azure, preferably with Azure Machine Learning, Docker, and AKS.Hands-on experience building cloud-native pipelines for model training, scoring, and monitoring.Familiarity with GenAI concepts and too","Hybrid in Chicago, Illinois",07/28/2025,Today,"Third Party, Contract",Depends on Experience,Easy Apply,Pending
AI/ML Engineer,Adbakx LLC,https://www.dice.com/job-detail/d0dbb1a9-514f-430b-a458-48854eedb73c,"Job Description:We are looking for an AI/ML Engineer to join our team and work on both traditional machine learning and modern large language model (LLM) applications. This role involves building and deploying end-to-end solutions using models like XGBoost and Random Forest, as well as working on cutting-edge generative AI systems including Retrieval-Augmented Generation (RAG) and fine-tuning of LLMs.Key Responsibilities:Build and train machine learning models (e.g., Random Forest, XGBoost) for","Pleasanton, California",07/28/2025,Today,Full-time,Depends on Experience,Easy Apply,Pending
Data Scientist-Gen AI- Only W2,Idah Tech LLC,https://www.dice.com/job-detail/48d8ebab-abd3-4e66-a554-ad4f2335ea46,"Job Title: Data Scientist AI & Agentic AI Specialis Visa: H1B, USC 12 15 years of experience in Data Science - AI with a proven track record in building real-world AI systems. Strong proficiency in Python, TensorFlow, PyTorch, and cloud platforms (AWS, Azure, or Google Cloud Platform). Deep knowledge of Agentic AI, multi-agent systems, or goal-oriented agents. Hands-on experience with LLM orchestration frameworks like LangChain, AutoGPT, or CrewAI. Experience with prompt engineering, fine-tunin","Remote or Hybrid in Texas City, Texas",07/28/2025,Today,Contract,$50+,Easy Apply,Pending
GenAI Expert-Onsite-(Only W2)-6+ years experience,Care IT Services Inc,https://www.dice.com/job-detail/f9fd4605-d0dd-455a-8f82-194f125317e8,"GenAI Expert Location: Whippany, NJ Location: Whippany, NJ (Hybrid) Job Description: Core Responsibilities Design and implement end-to-end GenAI solutions using AWS Bedrock, incorporating foundation models like Claude and Titan Develop and optimize prompt engineering strategies for various use cases and business requirements Experience with RAG (Retrieval-Augmented Generation) implementations Create and maintain vector search solutions using AWS OpenSearch and other vector databases Implement an","Jersey City, New Jersey",07/28/2025,Today,Contract,$20 - $40,Easy Apply,Applied
Machine Learning Data Engineer,"Javen Technologies, Inc",https://www.dice.com/job-detail/c108cf7b-4041-436d-a06e-f5b96de1e0f8,"Hi, our direct client is hiring a Machine Learning Data Engineer in Cincinnati, OH (Onsite). Please view the requirements below and reply with suitable resumes. Machine Learning Data Engineer Location: Cincinnati, OH Experience: 8+ yrs Skills: SQL, Python, Snowflake, dbt, AWS, SageMaker, Databricks, cloud data platforms Duration: 6+ Months Job ID: 1566 Squad: Machine Learning Data Enablement squad in the Data Insights Tribe Required: In office 4 days a week minimum (Monday Thursday) Job Descrip","Cincinnati, Ohio",07/28/2025,Today,Contract,Depends on Experience,Easy Apply,Applied
"Data Scientist AI/ML - Wilmington, DE","TechniPros, LLC",https://www.dice.com/job-detail/b85182e7-d58b-4e74-8a2f-d20634b5604e,"Job Title: Data Scientist AI/ML Location: Wilmington, DE Domain: Pharmaceutical Long Term Contract Looking for W2 Candidates. No C2C Responsibilities: Lead the development and optimization of Generative AI (Gen AI) models, including LLM fine-tuning, Retrieval-Augmented Generation (RAG), and AI-driven quantitative research. Research and implement AI-related strategies, leveraging LLMs, NLP, and alternative data sources to drive investment decisions. Develop and integrate machine learning-base","Wilmington, Delaware",07/28/2025,Today,Contract,$DOE,Easy Apply,Applied
"Cloud Data Engineer - F2F Interview is Must in Phoenix , AZ - Hybrid",Bright Sol,https://www.dice.com/job-detail/44fb58d2-86f4-4120-a777-480b4bc70514,"Job Title: Cloud Data Engineer Location: Phoenix, AZ - F2F Interview Must Description: Cloud Data Engineer / PostgreSQL & NoSQL Specialist Min 10+ years No OPT's First preference local and for final round has to go F2F Relocation is also acceptable POSITION SUMMARY: The Cloud Data Engineer / PostgreSQL & NoSQL Specialist is a hands-on, cloud-focused technical role that sits at the intersection of cloud database administration and data engineering. This position plays a critical role in managin","Hybrid in Phoenix, Arizona",07/28/2025,Today,"Contract, Third Party",$50 - $60,Easy Apply,Applied
Machine Learning Engineer- Software Developer,MCS Group,https://www.dice.com/job-detail/8927ccd8-fb16-4c83-a26c-87e251f43191,"Job Title: Machine Learning Engineer You will need to currently be based in NY (or commutable distance) No relocation candidates unfortunately We're working with a fast-paced, innovation-focused team within a leading global financial services firm that's building cutting-edge AI applications from the ground up. This is an opportunity to work on entirely greenfield projects, no maintenance, no legacy systems, in a team that feels more like a start up than a traditional corporate environment. Abo","New York, New York",07/28/2025,Today,Full-time,$150000 - $250000 per annum,Easy Apply,Applied
Senior AI/ML Platform Engineer -C2H Role,"NITYA Software Solutions, Inc.",https://www.dice.com/job-detail/e3a2c2aa-1131-4c74-9f68-df540b0caa37,"Role: Senior AI/ML Platform Engineer Location: Austin, TX 78758 (100% Onsite) Contract to Hire (after 3 months ) Job Description: Bachelors or higher degree in Computer Science or equivalent major or equivalent experience 9+ years professional software engineering experience 3+ years specialized experience in AI/ML infrastructure, e.g., enabling and optimizing distributed training for scaling large ML models Experience with Python, with proficiency in frameworks such as PyTorch, TensorFlow, or",North Carolina,07/28/2025,Today,"Full-time, Contract, Third Party",,Easy Apply,Applied
GenBI data analytics consultant,"iTek People, Inc.",https://www.dice.com/job-detail/704fb240-151a-4c28-9db6-8191e521067b,"Role: GenBI data analytics consultants Location: West Sacramento, CA(Hybrid) Experience: 10+ Years JD Required Skills and Tools: Enterprise BI & Data Warehousing tools (e.g., Power BI, Tableau, SAP BI, Informatica) Machine Learning & AI platforms (e.g., Azure ML, AWS SageMaker, Databricks, OpenAI APIs) Data modeling and governance tools (e.g., Collibra, Alation, Talend, Informatica Axon) Strong understanding of GenAI, LLMs, and prompt engineering Excellent communication and stakeholder manag",Hybrid in California,07/28/2025,Today,"Contract, Third Party",Depends on Experience,Easy Apply,Applied
Machine Learning Engineer with Generative AI,PETADATA,https://www.dice.com/job-detail/f23bf6af-eba6-462b-ad64-9cd92b8b11b2,"Job Title: Machine Learning Engineer with Generative AI Location: Las Vegas, NV - REMOTE EXPERIENCE: 12+ YRS Job Type: W2/C2C PETADATA is currently hiring for the position of Machine Learning Engineer with Generative AI for one of their clients. Job Overview: We seek a forward-thinking Machine Learning Engineer with a deep focus on Generative AI technologies within the Azure ecosystem. This pivotal role is dedicated to pioneering AI-driven solutions, mainly to deploy a state-of-the-art chatb","Las Vegas, Nevada",07/28/2025,Today,"Full-time, Third Party, Contract",,Easy Apply,Applied
GenAI Engineer,"KPI Partners, Inc.",https://www.dice.com/job-detail/4661410b-c5e6-426c-b6dc-2fed316b15f8,"KPI Partners, A global consulting firm focused on strategy, technology, and digital transformation. We help companies tackle their most ambitious projects and build new capabilities. We provide solutions in Cloud, Data, Application Development & BI spaces. We enable your growth At KPI, you can become who you want to be and learn skills that will take you further in your career Continuously upgrade yourself Develop as a future leader Drive cloud enablement around the world Engineering Excellence",Remote,07/28/2025,Today,Contract,$70 - $80,Easy Apply,Applied
"Sr. Python AI/ML Engineer - Hybrid (New Jersey, Texas, Florida)",Brandon Consulting,https://www.dice.com/job-detail/9a74bbb8-c729-4ae4-9d91-e01b5976b707,Job Responsibilities: Understand the Business End to End. Understand the Application Architecture. Responsible for Designing and building Applications. Understand the project timelines and deadlines. Provide Impact analysis for new requirements or changes. Responsible for low level design with the team. Convey architectural solutions to all levels of professionals and leaders. Ensure Code Quality and Deliverables. Lead the team and deliverables -Prioritize work with stakeholders. Understand and,"Morris Plains, New Jersey",07/28/2025,Today,Contract,,Easy Apply,Applied
"Python Developer with AI Experience - Sagemaker, Gen AI",SES,https://www.dice.com/job-detail/e8be3995-e5d1-4f64-a57b-a4813f8bf298,"Python Developer with AI Experience - Sagemaker, Gen AI Top 7 Technical Skills: Python Gen AI SQL AWS Data Services LLM ML Sagemaker Top 2 Soft Skills: Confidence in Communication skills for Teamwork and sharing Stand alone to get work done, Independent Job Description: Experience: 8+ years overall in Software Engineering disciplines, preferably in the financial services industry 2-3 years of experience in AI/ML engineering roles Strong programming skills in Python, SQL and experience with AW","Hybrid in Herndon, Virginia",07/28/2025,Today,Full-time,Depends on Experience,Easy Apply,Applied
"Data Scientist - AI, Artificial Intelligenc, Agentic,",SES,https://www.dice.com/job-detail/f0c01dfc-df8f-4d8d-b36c-308607f71edc,"Data Scientist - Agentic AI Type: W2 With Benefits or W2 hourly - No C2C Location: Chantilly, VA Hybrid - Some onsite will be required occasionally Top 5 Technical Skills: Databricks AI tools Snowflake AI tools (new to market) LLMs LangGraph and LangFlow Agentic AI is a PLUS Top Soft Skills: Ability to communicate with users Collaboration Job Description: Key Responsibilities: Machine Learning Development:?Build and optimize machine learning models, including ARIMA, regression, classification m","Hybrid in Reston, Virginia",07/28/2025,Today,Full-time,Depends on Experience,Easy Apply,Applied
Machine Learning Engineer,INNOVIT USA INC,https://www.dice.com/job-detail/a24e48c9-d7a6-4569-a96a-4c2c8ec6bf68,Hiring: W2 Candidates Only Location: USA Visa: Open to any visa type with valid work authorization in the USA Experience Required: 6 to 12 years Description : You will work in a fast paced team to create and deliver new product and mission features to the network and security platform that many customers use on a daily basis You will actively engage and contribute to the network security community through collaborations You will be part of the team that is leading and driving industry technolog,"Jackson, Mississippi",07/28/2025,Today,"Full-time, Part-time, Contract, Third Party",,Easy Apply,Applied
"Data Scientist AI/ML - Nashville, TN","TechniPros, LLC",https://www.dice.com/job-detail/45e8adf3-f14e-43ed-a897-8f5ab6e2487e,"Job Title: Data Scientist AI/ML Location: Nashville, TN Domain: Healthcare Long Term Contract Looking for W2 Candidates. No C2C Job Summary: We are seeking a highly skilled and analytical Data Scientist to join our team. You will be responsible for leveraging data to drive business insights, develop predictive models, and support data-driven decision-making across departments. The ideal candidate is proficient in data mining, statistical modelling, machine learning, and data visualization t","Nashville, Tennessee",07/28/2025,Today,Contract,$DOE,Easy Apply,Applied
Data Scientist,Proventus Metrics,https://www.dice.com/job-detail/c332647a-ff6b-4859-99a3-ef8b2b34d851,"Data Scientist Key Responsibilities - Lead end-to-end training and fine-tuning of Large Language Models (LLMs), including both open-source (e.g., Qwen, LLaMA, Mistral) and closed-source (e.g., OpenAI, Gemini, Anthropic) ecosystems. Architect and implement GraphRAG pipelines, including knowledge graph representation and retrieval for enhanced contextual grounding. Design, train, and optimize semantic and dense vector embeddings for document understanding, search, and retrieval. Develop semantic r",Remote,07/28/2025,Today,"Full-time, Third Party","Up to $100,000",Easy Apply,Applied
Sr. AI/ML Engineer,Pegasys Information Technologies,https://www.dice.com/job-detail/d6c4883d-6c6d-47b3-923d-2e1fffbdae92,"Job Title: Sr. AI/ML Engineer Location: Jersey City, NJ/ NYC, NY (Onsite) Duration: Long term Job Description : Designing and developing AI/ML applications and LLM, JAVA Spark.sound knowledge on GEN AILLMs & RAG Applications: Fine-tune and deploy LLMs integrated with vector databases (FAISS, Pinecone, ChromaDB).Experienced AI/ML Engineer with expertise in Machine Learning, Deep Learning, NLP, Generative AI, and Big Data Engineering.Proven track record in leading large-scale AI/ML initiatives u","Jersey City, New Jersey",07/28/2025,Today,"Contract, Third Party",Depends on Experience,Easy Apply,Applied
Google Cloud Platform ML Architect -Data - Full time job in Chaska MN (100% onsite),EdgeAll,https://www.dice.com/job-detail/6e57d4a8-5578-469c-b973-042f8472e64b,"Role : Google Cloud Platform ML Architect -Data Location : Chaska MN (100% onsite) Hire type : FTE (No H1 Transfer) Detailed JD:Responsible for designing, implementing, and managing data and machine learning solutions on Google Cloud Platform Key Responsibilities: Design end-to-end data solutions, including data ingestion, storage, processing, and analysis pipelines, as well as machine learning model development, deployment, and monitoring pipelines.Design and implement scalable, secure, and cos","Chaska, Minnesota",07/28/2025,Today,Full-time,Depends on Experience,Easy Apply,Applied
Java Developer with Gen AI,INNOVIT USA INC,https://www.dice.com/job-detail/aa37affb-bfc2-420f-9fdf-eabc8991150d,"Hiring: W2 Candidates Only Location: USA Visa: Open to any visa type with valid work authorization in the USA Level: Mid to Lead positions Job Details Artificial Intelligence (Required) Knowledge of Generating Artificial Intelligence (AI), Machine Learning (ML), and Large Language Models (LLMs). Understanding of text processing, tokenization, sentiment analysis, and language models like GPT or BERT Understanding of supervised, unsupervised, and reinforcement learning. Familiarity with ML algor","Salem, Oregon",07/28/2025,Today,"Full-time, Part-time, Contract, Third Party",,Easy Apply,Applied
AI Engineer,Wise Equation Solutions Inc.,https://www.dice.com/job-detail/145f9124-8501-4ac3-9cd0-26644abe58d2,"Duration:12 months (Extendable) Work Hours: 40 hrs/week. Location: 28th street LIC, New York. Qualifications and Skills: Bachelor s degree in Computer Science, Engineering, Information Technology, or related field2-5 years of experience in automation, RPA, or AI developmentExperience with business processes and workflow optimizationFamiliarity with Microsoft Office Suite and enterprise applicationsMicrosoft Certified: Power Automate RPA Developer AssociateAzure OpenAI or Azure AI certification","New York, New York",07/28/2025,Today,Contract,$60 - $70,Easy Apply,Applied
Python Developer,Collabera LLC,https://www.dice.com/job-detail/5ad715d4-f87d-4da3-adf0-683a508d6fab,"Position Details: Industry: Banking Financial Client Location: NYC, NY (Need local - Hybrid Schedule) Job Title: Core Python Developer Duration: 18 months (Possible for extension) Pay Range: $76 - $78 Job Specification: We are seeking a talented Senior Python Developer to join our team working on a GenAI Platform across the banking sector. The ideal candidate will have strong Core Python skills and experience in application development. This role will involve writing and testing code using a T","New York, New York",07/28/2025,Today,Full-time,$78.0000 - $79.0000,Easy Apply,Applied
Data Engineer,"Motion Recruitment Partners, LLC",https://www.dice.com/job-detail/e9d6fd83-71f2-403c-8079-d01a279941bd,"We are an investment firm and brokerage, seeking an experienced Data engineer who specializes in Machine learning initiatives. We are a smaller data environment who runs like a startup. This is an environment where independence meets collaboration. As a Data Engineer you will be responsible for building and maintaining data pipelines along with ensuring a seamless data flow to all systems across our organization. A strong candidate will have experience with data warehousing concepts and design,","Dallas, Texas",07/19/2025,Today,Full-time,120k - 140k,Easy Apply,Applied
Enterprise Architect / Cloud Architect with AI/ML,ALIS Software,https://www.dice.com/job-detail/837ce3f0-6a05-4212-b2ac-b7e4de64048a,"JOB DESCRIPTION POSITION: Enterprise Architect DURATION: Long term Client: HHSC Location: Austin, TX Responsible for translating the client's business requirements into specific systems, applications or process designs with interlocked financial modeling for very large complex technical solutions. Analyzes customer service requirements and designs service solutions to meet those objectives. Primary expert to construct the specific solution, scope document, risk profile, and corresponding finan","Austin, Texas",07/16/2025,Today,"Contract, Third Party",Depends on Experience,Easy Apply,Applied
Google Cloud Platform ML Architect -Data : Chaska MN (100% onsite),EdgeAll,https://www.dice.com/job-detail/0c02dcd4-edea-462d-87a6-856d3e0e24ce,"Role : Google Cloud Platform ML Architect -Data Location : Chaska MN (100% onsite) Hire type : FTE (No H1 Transfer) Salary : $130K Detailed JD:Responsible for designing, implementing, and managing data and machine learning solutions on Google Cloud Platform Key Responsibilities: Design end-to-end data solutions, including data ingestion, storage, processing, and analysis pipelines, as well as machine learning model development, deployment, and monitoring pipelines.Design and implement scalable,","Chaska, Minnesota",07/28/2025,Today,Full-time,Depends on Experience,Easy Apply,Applied
AI Prompt Engineer and RPA Implementation Specialist,Fixity Technologies,https://www.dice.com/job-detail/c794659a-06cc-4c25-aa42-1354a42166ea,"Duration: 12 Months, extension possible based on needs and performance Job Title: AI Prompt Engineer and RPA Implementation Specialist Summary of Position: The nation's leading local health department seeks a skilled AI Prompt Engineer / AI Agent Implementation / RPA Specialist to join our technology team. This role combines cutting-edge AI capabilities with robotic process automation to drive digital transformation across our organization. The ideal candidate will have expertise in designing A","Queens, New York",07/28/2025,Today,"Full-time, Part-time, Contract, Third Party",USD 65-70,Easy Apply,Applied
AI/ML Engineer,Adbakx LLC,https://www.dice.com/job-detail/341f0929-e095-45c1-8079-ea21a1fe0e3a,"Job Overview:As an AI/ML Engineer at Google, you will be responsible for designing and implementing machine learning models and algorithms that enhance our products and services. You will work closely with cross-functional teams to deliver innovative solutions utilizing cutting-edge AI technologies. This role requires a deep understanding of machine learning principles and practical application of AI techniques to solve complex problems.Key Responsibilities:- Design and develop machine learning","Pleasanton, California",07/17/2025,Today,Part-time,Depends on Experience,Easy Apply,Applied
