title,company,link,description,location,date_added,date_posted,job_type,salary,apply_text,status
Business Intelligence Developer,Catapult Solutions Group,https://www.dice.com/job-detail/1d29a590-bc28-43cd-9fef-c0c677e7e3ca,"Business Intelligence Developer (PUBLIC TRUST REQUIRED) Department: Information Technology Location: Remote Role Type: Full-time 6-Month Contract About Our Client Our client is a well-established government contractor known for delivering advanced IT and engineering services to federal agencies across the United States. With decades of experience supporting mission-critical programs, the company specializes in areas such as data analytics, cloud transformation, and cybersecurity. Its work empow",Remote,07/16/2025,Today,Contract,Depends on Experience,Easy Apply,Applied
Senior Project Manager AI/ML Engineering,SBS Corp.,https://www.dice.com/job-detail/4a6ab62a-ed53-44dc-aab1-728e6d40eea9,"Job Summary: We are seeking a highly skilled and experienced Senior Project Manager with a strong background in AI/ML Engineering to lead and manage complex projects within our organization. The ideal candidate will possess a deep understanding of AI/ML technologies and methodologies, coupled with exceptional project management skills. This role requires a strategic thinker who can effectively communicate with technical teams and stakeholders, ensuring successful project delivery and alignment w","Atlanta, Georgia",07/15/2025,Today,"Contract, Third Party",,Easy Apply,Applied
Google Cloud Platform Data Engineer,"Acadia Technologies, Inc.",https://www.dice.com/job-detail/71f6e491-c308-445a-ac3e-e8fcb51c3ce3,"Key Skills for a Google Cloud Platform Data Engineer:Google Cloud Platform Proficiency: Deep understanding of Google Cloud Platform services like BigQuery, Cloud Storage, Cloud SQL, Dataflow, Dataproc, Cloud Pub/Sub, and Cloud Composer. Experience with data warehousing solutions on Google Cloud Platform. Ability to design, build, and manage scalable and reliable data pipelines. Data Management: Data modeling and database management (SQL and NoSQL). Proficiency in ETL (Extract, Transform, Load) p","Las Vegas, Nevada",07/18/2025,Today,Full-time,"$60,000+",Easy Apply,Applied
Healthcare Data Scientist FHIR & HL7 Expertise,"E-Solutions, Inc.",https://www.dice.com/job-detail/0223afed-099d-4f25-bf8d-89179ab10f78,"Job title: - Healthcare Data Scientist FHIR & HL7 Expertise Location: Philadelphia PA Job Summary: We are seeking a curious and motivated Machine Learning Engineer to join the Foundational Data Analytics (FDA) Program - a strategic initiative aimed at building a modern, intelligent data ecosystem. In this role, you will support the development and deployment of machine learning models that power enterprise analytics, deliver predictive insights, and drive transformation across the healthcare","Philadelphia, Pennsylvania",07/23/2025,Today,Third Party,,Easy Apply,Applied
"PostgreSQL Data Engineer at Irvine, CA (hybrid - 3 times per week) - Locals - In-person interview",PamTen Inc,https://www.dice.com/job-detail/ac7f382a-a730-4317-a25e-02ef91446086,"Job Title: Data Engineer with PostgreSQLLocation: Irvine, CA (hybrid - 3 times per week)Job Type: Contract Project description:We're looking for a Data Engineer (not data scientist or analyst) with deep expertise in modern PostgreSQL database schema design and performance tuning. We've already taken care of most of the low-hanging fruit (dashboards, reviewing query plans, and db index / materialized view tuning), as well as having a mature ETL process that runs on Airflow. So while there will be","Hybrid in Irvine, California",07/22/2025,Today,"Third Party, Contract",Depends on Experience,Easy Apply,Applied
Business Intelligence Analyst 3,Aditi Consulting,https://www.dice.com/job-detail/48b69ee9-976a-4daf-811d-bde05473934f,"Payrate: $53.00 - $55.00/hr. Summary: The main function of a Business Systems Analyst is to perform the analysis, design, implementation, modification, and daily functional support of all applications. Job Responsibilities: Specific work in PowerBI with Semantic Models, Applications, workspaces, dashboards, and reports from Kusto and CosmosDB data sources. Works with key stakeholders within all business functions to align technology solutions with business strategies Gathers requirements from bu","Remote or Hybrid in Redmond, Washington",07/21/2025,Today,Contract,$53 - $55 hr,Easy Apply,Applied
Lead Python Developer/Architect-Remote,Kanshe Infotech,https://www.dice.com/job-detail/d1def75b-0bef-4f98-8f9c-c5a698a1b274,"Job Title: Lead Python Developer/Architect Location: Remote Duration: 24-Month Contract Exp- 12+ Years ONLY W2 Job Overview: hiring a Lead Python Developer / Architect to take ownership of core systems tied to product tracking and infrastructure. The ideal candidate is an expert Python developer with 3+ years of team leadership experience, strong architectural capabilities, and hands-on development skills in distributed environments. This is a highly technical leadership role in a collaborati",California,07/18/2025,Today,Contract,,Easy Apply,Applied
QA Analyst - Data And ML Focus,Compunnel Inc.,https://www.dice.com/job-detail/7993cd85-b7b9-42db-8067-63b826ea5353,"Job Summary We are seeking a detail-oriented and technically proficient QA Analyst to support a machine learning (ML) platform focused on full-stack and data-centric applications. This role bridges automation, data engineering, and ML operations, ensuring robust testing of production-grade applications and data pipelines. The ideal candidate will be business-savvy, collaborative, and capable of validating data integrity and application functionality across teams. Key Responsibilities Lead and","Richmond, Virginia",07/22/2025,Today,Contract,DOE,Easy Apply,Applied
AI Prompt Engineer and RPA Implementation Specialist,OnwardPath Technology Solutions LLC,https://www.dice.com/job-detail/df0650ee-3925-4003-90e3-2348d50b4f68,"Title: Location: Long Island City, NY (100% onsite) Long term contract There will be 2 rounds of interviews. Both will be in-person in Long Island City, NY. The Client is seeking a skilled AI Prompt Engineer / AI Agent Implementation / RPA Specialist to join our technology team. This role combines cutting-edge AI capabilities with robotic process automation to drive digital transformation across our organization. The ideal candidate will have expertise in designing AI agents, crafting effectiv","Queens, New York",07/24/2025,Today,Contract,Depends on Experience,Easy Apply,Applied
Machine Learning Engineer,INNOVIT USA INC,https://www.dice.com/job-detail/bea57786-4a8a-4471-a683-5d03f3cfdf80,"Hiring: W2 Candidates Only Location: USA Visa: Open to any visa type with valid work authorization in the USA Level: Mid to Lead positions Responsibilities: Deploy machine learning models on cloud platforms (AWS, Google Cloud Platform, Azure) Build and maintain ML pipelines using Airflow or Kubeflow Track experiments and manage ML lifecycle with tools like mlflow and TensorBoard Ensure model explainability, monitoring, and optimization for deployment Implement secure deployment practices using D","Boise, Idaho",07/17/2025,Today,"Full-time, Part-time, Contract, Third Party",,Easy Apply,Applied
DSP System Architect (high-speed SerDes or communication systems),EdgeAll,https://www.dice.com/job-detail/904e1902-1ada-4484-8479-7d309f4e1ba0,"RoleWe are seeking a DSP System Architect to optimize digital signal processing (DSP) architectures for high-speed SerDes (Serializer/Deserializer) transceivers. This role defines system-level architecture, algorithms, and performance needs. The architect will work closely with cross-functional teams to debug, analyze data and bring SerDes solutions to market.ResponsibilitiesCollaborate with analog, digital, and mixed-signal design teams to implement DSP solutions.Collaborate with application an","San Jose, California",07/16/2025,Today,Full-time,Depends on Experience,Easy Apply,Applied
Data Scientist (767893),Techmatrix Consulting,https://www.dice.com/job-detail/4865bd04-186b-4c8d-9256-3e603efaa31a,"Role:Data Scientist (767893) Client: GA DHS Location: 47 Trinity Ave SW, Atlanta, GA 30334 Hybrid Max pay Rate: $75/hr on W2 - Per Hour We are seeking a highly analytical and detail-oriented Data Scientist with experience in Risk and Fraud analytics to join our growing team. This role will focus on developing and deploying machine learning models, statistical methods, and data-driven strategies to detect risky behaviors and prevent fraudulent activities across our products and services. Key Re","Hybrid in Atlanta, Georgia",07/22/2025,Today,Contract,Up to $75,Easy Apply,Applied
Deep Learning Expert- PyTorch,CSI Consulting,https://www.dice.com/job-detail/829d2f28-c38f-4463-be68-8ab2f0449100,"Deep Learning expert with strong PyTorch skills, Proven experience in training transformer models from scratch, and a passion for continuous learning actively upskilling in cutting-edge Agentic AI"" Must have extensively worked on PyTorch Transformer architecture, training models from scratch, attention mechanisms, sequence-to-sequence models, encoder-decoder, BERT, Good to have knowledge in Agentic AI (framework like: LangGraph, Semantic Kernel Machine Learning, Deep Learning (Large Language Mod",Remote,07/16/2025,Today,"Contract, Third Party",Depends on Experience,Easy Apply,Applied
AI Engineer,Mindlance,https://www.dice.com/job-detail/32df9d7d-e5a0-4aa3-b8af-ba270623e6c7,"Title: AI Engineer Location: Remote Advance your career with Mindlance! We have been connecting talented IT professionals with world-class companies since 1999. Mindlance is here to help you to find the perfect fit with just the right company. Currently, we are seeking an AI Engineer for an exciting career growth Opportunity. Make your next big career move with the kind of position that will allow you to be genuinely passionate about the work you do! Our recruiters will work closely with you to",Remote,07/27/2025,Today,Contract,Up to $80,Easy Apply,Applied
Data Scientist,Estuate Inc.,https://www.dice.com/job-detail/0a0a8f84-8145-4aa6-8a6d-8fdf4387116e,"Description: Data Scientist Onsite - Tucson Key Responsibilities: Work closely with the Tucson-based assay and algorithm development teams to ensure seamless data integration and maintain data integrity across complex digital pathology projects. Design, develop, and implement robust solutions to automate manual steps within the algorithm development and data management workflows, enhancing efficiency and reproducibility. Perform sophisticated image processing, data analysis, and predictive model","Tucson, Arizona",07/21/2025,Today,Contract,Depends on Experience,Easy Apply,Applied
Software Engineer 4 - Contingent,PTR Global,https://www.dice.com/job-detail/37759eb4-20da-4c50-95e7-2d090d8fc145,"html THIS JOB DESCRIPTION WAS CREATED BY AI, REVIEW BEFORE POSTING Position: Infrastructure Engineer Location: Charlotte, North Carolina, 28262 Duration: Contract Job ID: 168746 Pay Range: $60-75/hr. on W2 Job Overview: We are seeking a Lead Software Engineer within the Enterprise Services Management group for the Technology Exposure Management Vulnerability Response Engineering team. The role involves leading data design for Infrastructure, Container, and Application Vulnerabilities within","Charlotte, North Carolina",07/22/2025,Today,Full-time,USD 60.00 - 75.00 per hour,Easy Apply,Applied
Principal Data Scientist,Apex Systems,https://www.dice.com/job-detail/572182d8-69de-4e80-a723-ae43ba17c418,"Job#: 2081838 Job Description: Position Summary We are seeking a highly skilled and experienced Lead / Principal Data Scientist with a specialization in Machine Learning Engineering and Computer Vision to join our dynamic Data Science and AI team. In this pivotal role, you will be instrumental in transforming complex data into actionable insights and innovative solutions that drive our business strategy forward. You will leverage advanced machine learning, deep learning, and neural network tec","Findlay, Ohio",07/16/2025,Today,Full-time,,Easy Apply,Applied
Data Scientist in Risk and Fraud analytics,SYSTEM SOFT TECHNOLOGIES LLC,https://www.dice.com/job-detail/11d91315-85e6-4b93-bea1-973f6996a509,"HYBRID Atlanta GA Local Preferred We are seeking a highly analytical and detail-oriented Data Scientist with experience in Risk and Fraud analytics to join our growing team. This role will focus on developing and deploying machine learning models, statistical methods, and data-driven strategies to detect risky behaviors and prevent fraudulent activities across our products and services. Professional experience in data science. Proficient in Python, SQL, SAS and machine learning techniques.Expe","Hybrid in Atlanta, Georgia",07/22/2025,Today,"Contract, Third Party",Depends on Experience,Easy Apply,Applied
AI/ML Engineer,EPSoft Technologies LLC,https://www.dice.com/job-detail/b8897773-5b24-40da-8104-f19de9b99de0,"Role: AI/ML Engineer Location: Phoenix, AZ Day 1 Onsite Locals Only In Person Interview Required Job Type: Long Term Contract Must Have Skills - Python, SQL, Docker & Kubernetes, Fast API, Flask, MLOps, Machine Learning, LLM's, LangChain or similar orchestrator, Vector DB or similar, Google Cloud Platform, Google AutoML, Vertex AI & Build tools Job Duties: Design and implement scalable MLOps supportive data pipelines for data ingestion, processing, and storage. Experience deploying models wit","Phoenix, Arizona",07/17/2025,Today,"Contract, Third Party",,Easy Apply,Applied
Data Modeler (MISMO Standards),"ICSA, Inc.",https://www.dice.com/job-detail/3aee5604-b538-4684-98a6-6e7db75a9a58,"Job Description: Data Modeler (MISMO Standards) Location: Mclean VA HYBID MODEL Position Overview We are seeking a results-driven Data Modeler with specialized expertise in MISMO standards for the mortgage finance industry. This key role will design, develop, and maintain data models that ensure efficient, standardized data exchange aligned with industry best practices. You will collaborate within a multi-disciplinary team to modernize, integrate, and support data management processes across the","Hybrid in McLean, Virginia",07/15/2025,Today,Contract,Depends on Experience,Easy Apply,Applied
Data Analyst (Databricks),"DataStaff, Inc.",https://www.dice.com/job-detail/37c8741d-92ef-479c-9858-113b559ffe08,"DataStaff, Inc. is in need of a Data Analyst (Databricks) for a long-term contract opportunity with one of our direct clients in Raleigh, NC *This is a hybrid position, 3 days will be onsite Job Description: The Web Services group is seeking a skilled Data Analyst with strong experience in Azure Databricks to support the creation of data aggregations, dashboards, and reports. The ideal candidate will have hands-on expertise with Databricks (PySpark) and visualization tools, including both Datab","Hybrid in Raleigh, North Carolina",07/18/2025,Today,Contract,Depends on Experience,Easy Apply,Applied
AI Specialist,"Pyramid Consulting, Inc.",https://www.dice.com/job-detail/2dd3fda4-4f2b-425a-b377-6900c8a33ab0,"Immediate need for a talented AI Specialist. This is a 12+months contract opportunity with long-term potential and is located in Charlotte, NC (Remote). Please review the job description below and contact me ASAP if you are interested. Job ID: 25-78831 Pay Range: $73 - $83/hour. Employee benefits include, but are not limited to, health insurance (medical, dental, vision), 401(k) plan, and paid sick leave (depending on work location). Key Responsibilities: Design, develop, and maintain applicati",Remote,07/18/2025,Today,Contract,$73 - $83,Easy Apply,Applied
Data Scientist -Python SQL Big Data Platforms-Hybrid,Elite Technical,https://www.dice.com/job-detail/558f730f-5e03-423e-a108-79ca2596ca85,"Absolutely no third parties please !! Responsibilities Our Client is seeking a Data Scientist to Analyze complex datasets to uncover patterns, trends, and insights that drive strategic business decisions. Develop predictive models, machine learning algorithms, and statistical analyses to solve business problems and improve campaign or operational performance. Collaborate with business and technical teams to define data science use cases and translate business requirements into analytical soluti","Hybrid in Chicago, Illinois",07/22/2025,Today,Contract,$75 - $80,Easy Apply,Applied
ML Engineer,Marici Solutions,https://www.dice.com/job-detail/210bdffa-562d-48cc-8641-53ce214b7dca,"Role: ML Engineer Location: Santa Clara, CA, Seattle, WA, Tampa, FL, NYC,NY (hybrid) Full Time and Contract W2 Key Responsibilities: Design and implement robust anomaly detection algorithms using statistical, machine learning, and deep learning techniques.Develop scalable data pipelines to process and analyze large volumes of streaming and batch data.Collaborate with cross-functional teams (engineering, data science, product) to define problem statements, gather requirements, and deliver ML solu","Hybrid in Santa Clara, California",07/21/2025,Today,Full-time,Depends on Experience,Easy Apply,Applied
AI Architect,Lorvin Technologies,https://www.dice.com/job-detail/cb200093-2c2e-4496-8d86-4529df6bf399,"As an AI Architect, you will be in charge of designing and implementing AI capabilities for a Contact Center platform in a Healthcare Payer enterprise. You will work closely with Cloud and Machine Learning engineers, as well as the CRM development team to ensure the proper integration of AI technologies into the platform. You will be responsible for the strategy, design, implementation, and maintenance of AI solutions. This role requires a highly skilled professional with a deep understanding of","Hartford, Connecticut",07/17/2025,Today,"Third Party, Contract",$60+,Easy Apply,Applied
AI Architect,Sensiple Inc.,https://www.dice.com/job-detail/1d50509b-acf0-42cd-a71b-fd6d890596b6,"Sensiple Inc is a New Jersey corporation with over two decades of expertise in technology-driven solutions specialising in Customer Experience, Contact Center Solutions, Digital Transformation, Cloud Computing & Independent Testing. With an expert team that has enriched experience in executing & developing sustainable IT strategies in Healthcare, Technology, Retail, Logistics, Education, Telecommunications, Government and Media, we help our diverse customers to envision the future. By developing","Hartford, Connecticut",07/17/2025,Today,"Contract, Third Party",Depends on Experience,Easy Apply,Applied
Senior AI/ML Specialist- Need Clearance: Public Trust or Higher levels,Invixon Technologies,https://www.dice.com/job-detail/543841e6-a89b-428c-90f6-7f8397e68d8b,"Role: Senior AI/ML Specialist Location: 100% Remote Scheduled Weekly Hours: 40 Clearance: Public Trust or Higher levels Position Overview: We are seeking a Senior AI/ML Specialist to lead scalable ML solution development in AWS/Databricks with end-to-end pipeline and team leadership experience. Required Skills & Experience: 10+ years of hands-on experience in AI/ML, applied data science, or machine learning engineeringExtensive Python proficiency with real-world experience building, optimizing,",Remote,07/22/2025,Today,"Contract, Third Party",$60 - $70,Easy Apply,Applied
GenAI Lead / Architect,TalTeam,https://www.dice.com/job-detail/ffc6a515-1e35-4fd3-a886-fe064e1c172a,"Position : GenAI Lead / Architect Location : New York City NY Direct Client Requirement - Fulltime Position Job Description: We are seeking a highly skilled and visionary Generative AI Lead / Architect to spearhead the design, development, and deployment of cutting-edge AI solutions using foundation models (e.g., GPT, LLaMA, Claude). You will lead a team of AI engineers and researchers to build scalable and impactful GenAI-driven systems for enterprise applications across domains like customer","New York, New York",07/21/2025,Today,Full-time,Depends on Experience,Easy Apply,Applied
Sr Data Scientist,Dia Software Solutions,https://www.dice.com/job-detail/ae580e7a-5997-49a3-8987-27a4a0738288,"Hi, Greetings from DIA SOFTWARE SOLUTIONS LLC! We reaching out about an exciting Direct client opportunity with one of our clients. Please review the requirements and let me know if you are interested in this position? Direct client Req:: Need Sr Data Scientist GA, Hybrid PLEASE SEND THE RESUMES TO SKUMAR AT DIASOFTWARESOLUTIONS DOT COM ! Job Description: We are seeking a highly analytical and detail-oriented Data Scientist with experience in Risk and Fraud analytics to join our growing team. T","Hybrid in Atlanta, Georgia",07/22/2025,Today,"Third Party, Contract",Depends on Experience,Easy Apply,Applied
"Data Scientist - AI, Artificial Intelligenc, Agentic,",SES,https://www.dice.com/job-detail/8e73ee13-fce4-41ab-bb0e-5013255f63e6,"Data Scientist - Agentic AI Type: W2 With Benefits or W2 hourly - No C2C Location: Chantilly, VA Hybrid - Some onsite will be required occasionally Top 5 Technical Skills: Databricks AI tools Snowflake AI tools (new to market) LLMs LangGraph and LangFlow Agentic AI is a PLUS Top Soft Skills: Ability to communicate with users Collaboration Job Description: Key Responsibilities: Machine Learning Development:?Build and optimize machine learning models, including ARIMA, regression, classification m","Hybrid in Reston, Virginia",07/18/2025,Today,Full-time,Depends on Experience,Easy Apply,Applied
Lead Data Engineer,Trova Search,https://www.dice.com/job-detail/dd539e75-d07c-4c87-8f56-befa574e48df,"This is a full-time, W-2 position. POSITION SUMMARY The Lead Data Engineer (""LDE"") will be responsible for developing and executing the technology roadmap to enhance the use of data throughout the company's operations. That roadmap will include the effective application of machine learning and artificial intelligence to support the intake and ingestion of insurance submission applications, third-party data, warehousing, reporting, analytics and other data used in the underwriting process, with","Hybrid in Jersey City, New Jersey",07/15/2025,Today,Full-time,"$160,000 - $200,000",Easy Apply,Applied
AWS Sagemaker Data Science,Apex 2000,https://www.dice.com/job-detail/6814a85a-44de-4719-adaf-1add81501dd8,"Responsibilities: Assess existing machine learning models, workflows, and infrastructure ( Python( Anaconda) for migration to AWS SageMaker.Design and implement migration strategies for on-premises, other cloud platforms, or older SageMaker environments to target SageMaker services.Leverage various SageMaker services, such as SageMaker Studio, Pipelines, Model Registry, and Endpoints, to streamline the ML lifecycle and model deployment.Prepare and validate data for training and inference within",Remote,07/15/2025,Today,"Contract, Third Party",Up to $75,Easy Apply,Applied
Agentic Data Engineer,"Beacon Systems, Inc",https://www.dice.com/job-detail/2a853c78-120e-4fcd-92e1-aef8a7c54eec,"Beacon Systems, Inc, delivers Program Management, Science, Engineering, and Technology Solutions to Federal, Commercial State, and Local Agencies. We are a subsidiary of Radiant Digital Solutions. Our Technology support to many DoD Agencies, NASA, Voice of America, FDA, and State Agencies such as State of FL, RI, MS, ND, VA, and WV extends our delivery of solutions worldwide. We are looking for a Agentic Data Engineer - Hybrid - Richmond, VAIf you are interested in applying for this requirement,","Hybrid in Richmond, Virginia",07/17/2025,Today,Contract,Depends on Experience,Easy Apply,Applied
Sr. Data Engineer (Snowflake / AWS / Python),"RNR IT Solutions, Inc.",https://www.dice.com/job-detail/10032813-fc74-45aa-b5f8-b3d4445507d9,"Job Description: We are seeking a Senior Data Engineer with deep expertise in Snowflake, AWS Cloud, and Python to architect and implement large-scale, high-performance data solutions. The ideal candidate will be responsible for building robust data pipelines, optimizing Snowflake environments, integrating diverse data sources, and enabling advanced analytics. This role requires someone who can work closely with data scientists, analysts, and business teams to ensure data reliability, scalability","Hybrid in Dallas, Texas",07/22/2025,Today,Contract,$60 - $80,Easy Apply,Applied
Google Cloud Platform Data Engineer,Akkodis,https://www.dice.com/job-detail/d46ab300-bde9-46e2-b966-56849ed2a39d,"Akkodis is seeking a Google Cloud Platform Data Engineer for a contract job with a client in Dearborn, MI. You willdesign and deploy scalable data engineering solutions on Google Cloud Platform using tools like BigQuery, Dataflow, and Pub/Sub to support enterprise analytics. Rate Range: $62/hour to 68/hour; The rate may be negotiable based on experience, education, geographic location, and other factors. Google Cloud Platform Data Engineer job responsibilities include: Design and implement sca","Dearborn, Michigan",07/22/2025,Today,Full-time,USD 62.00 - 68.00 per hour,Easy Apply,Applied
Generative AI Architect,Nityo Infotech Corporation,https://www.dice.com/job-detail/49b8e844-db00-4030-b696-a0eeebf55051,"Role : Generative AI Architect Location : Remote Experience: 5+ years in AI/ML with a focus on Generative AI Background: The client s platform uses Generative AI models to summarize and derive insights from vast datasets. While the team has built a strong foundation, they require an expert in LLMs and dynamic prompting to create scalable, intelligent solutions and drive AI innovation. Key Responsibilities: Dynamic Prompt ManagementDesign frameworks for handling dynamic and use-case-specific pro",Remote,07/18/2025,Today,"Contract, Third Party",$70 - $80,Easy Apply,Applied
